id,left_Song_Name,left_Artist_Name,left_Album_Name,left_Genre,left_Price,left_CopyRight,left_Time,left_Released,right_Song_Name,right_Artist_Name,right_Album_Name,right_Genre,right_Price,right_CopyRight,right_Time,right_Released
856235,Good for You ( feat . A$ AP Rocky ) [ KASBO Remix ],Selena Gomez,Good for You ( feat . A$ AP Rocky ) [ Remixes ] - Single,"Pop , Music",$ 1.29,2015 Interscope Records,3:41,4-Sep-15,Good For You [ feat . A$ AP Rocky ] [ Explicit ],Selena Gomez,Good For You [ Explicit ],Pop,$ 1.29,( C ) 2015 Interscope Records,3:41,"August 19 , 2015"
30184,Because of Your Love,Kenny Chesney,Greatest Hits,"Country , Music , Contemporary Country , Urban Cowboy",$ 0.99,2000 BMG Entertainment,4:16,26-Sep-00,Shadow In The Corner Of Your Mind,Kenny Rogers,49 All Time Greatest Hits,"Country , Traditional Country , Cowboy",$ 0.89,( c ) 2008 Goldenlane Records,2:46,"August 1 , 2008"
421824,Will the Circle Be Unbroken,"Warren Haynes , Gregg Allman , Derek Trucks , Susan Tedeschi , Devon Allman , Robert Randolph , Jimmy Hall , Sam Moore , Keb ' Mo ' , Brantley Gilbert , Dr. John , Pat Monahan , John Hiatt , Taj Mahal , Widespread Panic , Trace Adkins , Vince Gill , Martina McBride , Eric Church , Jackson Browne , Zac Brown & The Allman Brothers Band",All My Friends : Celebrating the Songs & Voice of Gregg Allman,"Rock , Music",$ 1.29,"‰ ãÑ 2014 Blackbird Production Partners , LLC . Under Exclusive License Rounder Records . Manufactured and Distributed by Concord Music Group , Inc.",8:56,6-May-14,To Walk Behind the Rows,"Sopor Aeternus , The Ensemble Of Shadows",Children of the Corn,"Alternative Rock , Goth & Industrial , Rock",$ 1.29,Apocalyptic Vision Records GmbH,6:15,"February 13 , 2015"
609822,X2CU,Jason Derulo,Everything Is 4,"Pop , Music , Rock , R&B / Soul , Contemporary R&B , Dance",$ 1.29,2015 Warner Bros. . Records Inc.,5:13,1-Jun-15,X2CU,Jason Derulo,Everything Is 4 [ Explicit ],Pop,$ 1.29,2011 Because Music,5:14,"May 26 , 2015"
855320,You 're Not My God,Keith Urban,Golden Road,"Country , Music , Honky Tonk , Contemporary Country",$ 1.29,2002 Capitol Records Nashville,8:31,4-Oct-02,Somebody Like You,Keith Urban,Golden Road,Country,$ 1.29,( C ) 2002 Capitol Records Nashville,5:23,"October 4 , 2002"
660640,Whateva ( feat . Monty ),Fetty Wap,Fetty Wap ( Deluxe ),"Hip-Hop/Rap , Music , Rap",Album Only,2015 300 Entertainment/RGF Productions,5:11,,Time ( feat . Monty ) [ Explicit ],Fetty Wap,Fetty Wap ( Deluxe ) [ Explicit ],Rap & Hip-Hop,$ 1.29,"( C ) 2000 Mute Records Ltd. , a BMG Company , under exclusive license to INgrooves",4:38,"September 25 , 2015"
318588,Marry the Night,Lady Gaga,Born This Way,"Pop , Music , Rock , Dance",$ 1.29,‰ ãÑ 2014 Interscope Records,4:24,5-Aug-14,Marry The Night,Lady Gaga,Born This Way,"Dance & Electronic , Pop , House",$ 1.29,( C ) 2011 Interscope Records,4:24,"May 23 , 2011"
819861,Club Ca n't Handle Me ( Ridney Remix ),Flo Rida,Club Ca n't Handle Me ( feat . David Guetta ) [ From `` Step Up 3D '' ] { The Remixes } - EP,"Dance , Music",$ 1.29,2010 Atlantic Recording Corporation for the United States and WEA International Inc. for the world outside of the United States,6:10,17-Aug-10,Gdfr ( Feat . Sage The Gemini & Lookas ) [ Nolaswift Remix ],Flo Rida,Gdfr ( Feat . Sage The Gemini & Lookas ) [ Remixes ],Rap & Hip-Hop,$ 1.29,2014 Atlantic Recording Corporation for the United States and WEA International Inc. for the world outside of the United States . A Warner Music Group Company,3:47,"January 21 , 2015"
661535,Rewind ( feat . Monty ),Fetty Wap,Fetty Wap,"Hip-Hop/Rap , Music , Rap",Album Only,2015 300 Entertainment/RGF Productions,5:36,,Jugg ( feat . Monty ) [ Clean ],Fetty Wap,Fetty Wap [ Clean ],Rap & Hip-Hop,$ 1.29,"( C ) 2000 Mute Records Ltd. , a BMG Company , under exclusive license to INgrooves",3:20,"September 25 , 2015"
336874,Blue Velvet,Lana Del Rey,Born To Die - The Paradise Edition,"Alternative , Music , Rock , Adult Alternative",$ 1.29,‰ ãÑ 2012 Lana Del Rey under exclusive licence to Polydor Ltd. ( UK ) . Under exclusive licence to Interscope Records in the USA,2:38,13-Nov-12,Blue Jeans ( Remastered ),Lana Del Rey,Born To Die [ Explicit ],"Alternative Rock , Indie & Lo-Fi",$ 1.29,( C ) 2012 Lana Del Rey under exclusive licence to Polydor Ltd. ( UK ) . Under exclusive licence to Interscope Records in the USA,3:29,"January 30 , 2012"
663013,Whateva ( feat . Monty ),Fetty Wap,Fetty Wap ( Deluxe ),"Hip-Hop/Rap , Music , Rap",Album Only,2015 300 Entertainment/RGF Productions,5:11,,No Days Off ( feat . Monty ) [ Explicit ],Fetty Wap,Fetty Wap [ Explicit ],Rap & Hip-Hop,$ 1.29,"( C ) 2000 Mute Records Ltd. , a BMG Company , under exclusive license to INgrooves",5:04,"September 25 , 2015"
304164,True Colors ( feat . Nicki Minaj ),Wiz Khalifa,Blacc Hollywood,"Hip-Hop/Rap , Music , Rap , East Coast Rap , Hardcore Rap , Rock",$ 1.29,2014 Atlantic Recording Corporation for the United States and WEA International Inc. for the world outside of the United States . A Warner Music Group Company,4:15,19-Aug-14,KK ( feat . Project Pat & Juicy J ) [ Explicit ],Wiz Khalifa,Blacc Hollywood [ Explicit ],Rap & Hip-Hop,$ 1.29,2014 Atlantic Recording Corporation for the United States and WEA International Inc. for the world outside of the United States . A Warner Music Group Company,4:09,"August 19 , 2014"
425179,The Back Roads and the Back Row,Cole Swindell,Cole Swindell,"Country , Music , Contemporary Country",$ 1.29,2014 Warner Music Nashville LLC and WEA International Inc. for the world outside the U.S.,3:41,18-Feb-14,Ai n't Worth The Whiskey,Cole Swindell,Cole Swindell,Country,$ 1.29,"( C ) 2011 UMG Recordings , Inc.",3:11,"February 18 , 2014"
938580,Rashi ( Outro ),Mark Ronson,Here Comes the Fuzz,"Dance,Music,Hip-Hop / Rap,Hip-Hop , Alternative Rap , R&B / Soul , Soul , Electronic",$ 0.99,2003 Elektra Entertainment for the United States and WEA International Inc. for the world outside of the United States .,2:01,29-Aug-03,Rashi ( Outro ),Mark Ronson,Here Comes The Fuzz [ Clean ],Dance & Electronic,$ 0.99,( c ) 2015 Karaoke Freaks,2:01,"August 29 , 2003"
888760,Ai n't Back Yet,Kenny Chesney,Greatest Hits II,"Country , Music , Urban Cowboy , Contemporary Country",$ 1.29,2010 Sony Music Entertainment,3:59,1-Mar-10,Back Where I Come From ( New Recording with Kenny 's Band ),Kenny Chesney,Greatest Hits,Country,$ 1.29,( C ) 2014 La industria Inc,4:16,"September 26 , 2000"
660653,Rewind ( feat . Monty ),Fetty Wap,Fetty Wap,"Hip-Hop/Rap , Music , Rap",Album Only,2015 300 Entertainment/RGF Productions,5:36,,Time ( feat . Monty ) [ Explicit ],Fetty Wap,Fetty Wap ( Deluxe ) [ Explicit ],Rap & Hip-Hop,$ 1.29,"( C ) 2000 Mute Records Ltd. , a BMG Company , under exclusive license to INgrooves",4:38,"September 25 , 2015"
662444,Whateva ( feat . Monty ),Fetty Wap,Fetty Wap ( Deluxe ),"Hip-Hop/Rap , Music , Rap",Album Only,2015 300 Entertainment/RGF Productions,5:11,,679 ( feat . Monty ) [ Explicit ],Fetty Wap,Fetty Wap [ Explicit ],Rap & Hip-Hop,$ 1.29,"( C ) 2000 Mute Records Ltd. , a BMG Company , under exclusive license to INgrooves",3:07,"September 25 , 2015"
742450,"Bubble Butt ( Radio Mix ) [ feat . Bruno Mars , 2 Chainz , Tyga & Mystic ]",Major Lazer,Free the Universe ( Extended Version ),"Electronic , Music , Rock , Reggae , Modern Dancehall , Dance",$ 1.29,‰ ãÑ 2013 Secretly Canadian / Mad Decent,3:27,18-Jun-13,"Bubble Butt ( Remix ) [ feat . Bruno Mars , 2 Chainz , Tyga & Mystic ]",Major Lazer,Free the Universe,Dance & Electronic,$ 1.29,2013 Secretly Canadian / Mad Decent,3:27,"April 16 , 2013"
300299,True Colors ( feat . Nicki Minaj ),Wiz Khalifa,Blacc Hollywood,"Hip-Hop/Rap , Music , Rap , East Coast Rap , Hardcore Rap , Rock",$ 1.29,2014 Atlantic Recording Corporation for the United States and WEA International Inc. for the world outside of the United States . A Warner Music Group Company,4:15,19-Aug-14,KK ( feat . Project Pat & Juicy J ) [ Explicit ],Wiz Khalifa,Blacc Hollywood ( Deluxe ) [ Explicit ],Rap & Hip-Hop,$ 1.29,2014 Atlantic Recording Corporation for the United States and WEA International Inc. for the world outside of the United States . A Warner Music Group Company,4:09,"August 19 , 2014"
660877,Whateva ( feat . Monty ),Fetty Wap,Fetty Wap ( Deluxe ),"Hip-Hop/Rap , Music , Rap",Album Only,2015 300 Entertainment/RGF Productions,5:11,,No Days Off ( feat . Monty ) [ Explicit ],Fetty Wap,Fetty Wap ( Deluxe ) [ Explicit ],Rap & Hip-Hop,$ 1.29,"( C ) 2000 Mute Records Ltd. , a BMG Company , under exclusive license to INgrooves",5:04,"September 25 , 2015"
302536,True Colors ( feat . Nicki Minaj ),Wiz Khalifa,Blacc Hollywood,"Hip-Hop/Rap , Music , Rap , East Coast Rap , Hardcore Rap , Rock",$ 1.29,2014 Atlantic Recording Corporation for the United States and WEA International Inc. for the world outside of the United States . A Warner Music Group Company,4:15,19-Aug-14,Hope ( feat . Ty Dolla $ ign ) [ Explicit ],Wiz Khalifa,Blacc Hollywood [ Explicit ],Rap & Hip-Hop,$ 1.29,2014 Atlantic Recording Corporation for the United States and WEA International Inc. for the world outside of the United States . A Warner Music Group Company,5:24,"August 19 , 2014"
126263,You Should Know Better,Andy Grammer,Andy Grammer,"Pop , Music , Rock , Adult Alternative",$ 1.29,‰ ãÑ 2011 S-Curve Records,3:23,14-Jun-11,You Should Know Better,Andy Grammer,Andy Grammer [ + Video ] [ + Digital Booklet ],Pop,$ 0.99,( C ) 2011 S-Curve Records,3:23,"June 14 , 2011"
742391,Mashup the Dance ( feat . The Partysquad & Ward 21 ),Major Lazer,Free the Universe ( Extended Version ),"Electronic , Music , Rock , Reggae , Modern Dancehall , Dance",$ 1.29,‰ ãÑ 2013 Secretly Canadian / Mad Decent,3:49,18-Jun-13,Jah No Partial ( feat . Flux Pavilion ) [ Skream Remix ],Major Lazer,Free the Universe,Dance & Electronic,$ 1.29,2013 Secretly Canadian / Mad Decent,5:47,"April 16 , 2013"
355706,Rum,Brothers Osborne,Brothers Osborne - EP,"Country , Music",$ 1.29,2014 EMI Records Nashville,3:26,9-Sep-14,Rum,Brothers Osborne,Brothers Osborne,Country,$ 1.29,( C ) 2014 EMI Records Nashville,3:28,"September 9 , 2014"
910650,The Good Life,Hannah Montana,Hannah Montana : The Movie ( Original Motion Picture Soundtrack ),"Soundtrack , Music , Country , Contemporary Country , Pop , Teen Pop , Honky Tonk , Rock",$ 1.29,‰ ãÑ 2009 Walt Disney Records,2:58,24-Mar-09,This Is The Life,Hannah Montana,Hannah Montana,"Children 's Music , Soundtracks , Pop",$ 1.29,( C ) 2006 Walt Disney Records,2:57,"October 24 , 2006"
530664,Till Dawn ( Here Comes the Sun ),The Weeknd,Echoes of Silence,"R&B / Soul , Music , Contemporary R&B , Rock",$ 1.29,"2015 The Weeknd XO , Inc.",5:19,17-Feb-15,Till Dawn ( Here Comes The Sun ),The Weeknd,Echoes Of Silence [ Explicit ],R&B,$ 1.29,"( C ) 2015 The Weeknd XO , Inc.",5:19,"February 17 , 2015"
660122,Whateva ( feat . Monty ),Fetty Wap,Fetty Wap ( Deluxe ),"Hip-Hop/Rap , Music , Rap",Album Only,2015 300 Entertainment/RGF Productions,5:11,,For My Team ( feat . Monty ) [ Clean ],Fetty Wap,Fetty Wap ( Deluxe ) [ Clean ],Rap & Hip-Hop,$ 1.29,"( C ) 2000 Mute Records Ltd. , a BMG Company , under exclusive license to INgrooves",3:28,"September 25 , 2015"
856042,Good for You ( feat . A$ AP Rocky ),Selena Gomez,Good for You ( feat . A$ AP Rocky ) - Single,"Pop , Music",$ 1.29,2015 Interscope Records,3:41,19-Aug-15,Good For You ( Kasbo Remix ) [ Feat . A$ Ap Rocky ],Selena Gomez,Good For You ( Remixes ),Pop,$ 1.29,( C ) 2015 Interscope Records,3:41,"September 4 , 2015"
299940,True Colors ( feat . Nicki Minaj ),Wiz Khalifa,Blacc Hollywood,"Hip-Hop/Rap , Music , Rap , East Coast Rap , Hardcore Rap , Rock",$ 1.29,2014 Atlantic Recording Corporation for the United States and WEA International Inc. for the world outside of the United States . A Warner Music Group Company,4:15,19-Aug-14,True Colors ( feat . Nicki Minaj ) [ Explicit ],Wiz Khalifa,Blacc Hollywood ( Deluxe ) [ Explicit ],Rap & Hip-Hop,$ 1.29,2014 Atlantic Recording Corporation for the United States and WEA International Inc. for the world outside of the United States . A Warner Music Group Company,4:15,"August 19 , 2014"
661210,Whateva ( feat . Monty ),Fetty Wap,Fetty Wap ( Deluxe ),"Hip-Hop/Rap , Music , Rap",Album Only,2015 300 Entertainment/RGF Productions,5:11,,For My Team ( feat . Monty ) [ Explicit ],Fetty Wap,Fetty Wap ( Deluxe ) [ Explicit ],Rap & Hip-Hop,$ 1.29,"( C ) 2000 Mute Records Ltd. , a BMG Company , under exclusive license to INgrooves",3:42,"September 25 , 2015"
14352,Thinking About You ( feat . Ayah Marar ),Calvin Harris,18 Months,"Dance , Music , House , Rock , Electronic",$ 1.29,2012 Sony Music Entertainment UK under exclusive license to Ultra Music / Roc Nation / Columbia Records,4:07,30-Oct-12,Thinking About You,Calvin Harris,18 Months [ Explicit ],Dance & Electronic,$ 1.29,( C ) 1995 Mercury Records Limited,4:07,"October 30 , 2012"
147003,Now You See Me ( Spellbound Remix ),Brian Tyler,Now You See Me ( Original Motion Picture Soundtrack ),"Soundtrack , Music",Album Only,2013 Glassnote Entertainment Group LLC,4:20,18-Jun-13,Wish You Were Here,Brian Tyler and Danny Elfman,Avengers : Age of Ultron ( Original Motion Picture Soundtrack ),Soundtracks,$ 1.29,( C ) 2015 MARVEL,1:36,"April 28 , 2015"
24302,Come Join the Murder ( From Sons of Anarchy ),The White Buffalo & The Forest Rangers,"Songs of Anarchy , Vol . 4 ( Music from Sons of Anarchy )","Soundtrack , Music",$ 1.29,"Compilation 2015 Twentieth Century Fox Television / Distributed by Columbia Records , a Division of Sony Music Entertainment",7:28,20-Feb-15,The Way You Do The Things You Do,The Temptations,"20th Century Masters : The Millennium Collection : Best Of The Temptations , Vol .1 - The '60s",Pop,$ 1.29,( C ) 1999 The Motown Record Company LP,2:42,"August 31 , 1999"
149178,Who 's the Artist ?,Danny Elfman,Big Eyes ( Music from the Original Motion Picture ),"Soundtrack , Music",$ 1.29,‰ ãÑ 2014 Interscope Records,2:56,23-Dec-14,The Last One,Brian Tyler and Danny Elfman,Avengers : Age of Ultron ( Original Motion Picture Soundtrack ),Soundtracks,$ 1.29,( C ) 2015 MARVEL,2:14,"April 28 , 2015"
661741,Rewind ( feat . Monty ),Fetty Wap,Fetty Wap,"Hip-Hop/Rap , Music , Rap",Album Only,2015 300 Entertainment/RGF Productions,5:36,,My Way ( feat . Monty ) [ Clean ],Fetty Wap,Fetty Wap [ Clean ],Rap & Hip-Hop,$ 1.29,"( C ) 2000 Mute Records Ltd. , a BMG Company , under exclusive license to INgrooves",3:32,"September 25 , 2015"
714606,The Heart Wants What It Wants ( Official Video ),Selena Gomez,For You,"Pop , Music , Teen Pop , Dance , Rock",$ 1.99,"2014 Hollywood Records , Inc.",4:35,24-Nov-14,Come & Get It,Selena Gomez,For You,Pop,$ 1.29,"( C ) 2014 Hollywood Records , Inc.",3:51,"November 24 , 2014"
303951,True Colors ( feat . Nicki Minaj ),Wiz Khalifa,Blacc Hollywood,"Hip-Hop/Rap , Music , Rap , Hardcore Rap , East Coast Rap , Rock",$ 1.29,2014 Atlantic Recording Corporation for the United States and WEA International Inc. for the world outside of the United States . A Warner Music Group Company,4:15,19-Aug-14,True Colors ( feat . Nicki Minaj ) [ Explicit ],Wiz Khalifa,Blacc Hollywood [ Explicit ],Rap & Hip-Hop,$ 1.29,2014 Atlantic Recording Corporation for the United States and WEA International Inc. for the world outside of the United States . A Warner Music Group Company,4:15,"August 19 , 2014"
318202,Marry the Night ( Zedd Remix ),Lady Gaga,Born This Way ( Bonus Track Version ),"Pop , Music",$ 1.29,‰ ãÑ 2014 Interscope Records,4:20,5-Aug-14,Electric Chapel ( Two Door Cinema Club Remix ),Lady Gaga,Born This Way - The Remix,Pop,$ 1.29,( C ) 2011 Interscope Records,3:59,"November 21 , 2011"
758684,Of All the Gin Joints In All the World,Fall Out Boy,From Under the Cork Tree,"Alternative , Music , Punk",$ 1.29,‰ ãÑ 2005 The Island Def Jam Music Group,3:11,3-May-05,Of All The Gin Joints In All The World,Fall Out Boy,From Under The Cork Tree,Rock,$ 1.29,( C ) 2005 The Island Def Jam Music Group,3:11,"May 3 , 2005"
662520,Whateva ( feat . Monty ),Fetty Wap,Fetty Wap ( Deluxe ),"Hip-Hop/Rap , Music , Rap",Album Only,2015 300 Entertainment/RGF Productions,5:11,,Jugg ( feat . Monty ) [ Explicit ],Fetty Wap,Fetty Wap [ Explicit ],Rap & Hip-Hop,$ 1.29,"( C ) 2000 Mute Records Ltd. , a BMG Company , under exclusive license to INgrooves",3:20,"September 25 , 2015"
759737,Nobody Puts Baby In the Corner,Fall Out Boy,From Under the Cork Tree,"Alternative , Music , Punk",$ 1.29,‰ ãÑ 2005 The Island Def Jam Music Group,3:20,3-May-05,7 Minutes In Heaven ( Atavan Halen ),Fall Out Boy,From Under The Cork Tree,Rock,$ 1.29,( C ) 2005 The Island Def Jam Music Group,3:02,"May 3 , 2005"
301711,True Colors ( feat . Nicki Minaj ),Wiz Khalifa,Blacc Hollywood,"Hip-Hop/Rap , Music , Rap , Hardcore Rap , East Coast Rap , Rock",$ 1.29,2014 Atlantic Recording Corporation for the United States and WEA International Inc. for the world outside of the United States . A Warner Music Group Company,4:15,19-Aug-14,"We Dem Boyz Remix ( feat . Rick Ross , ScHoolboy Q & Nas ) [ Explicit ]",Wiz Khalifa,Blacc Hollywood ( Deluxe ) [ Explicit ],Rap & Hip-Hop,$ 1.29,2014 Atlantic Recording Corporation for the United States and WEA International Inc. for the world outside of the United States . A Warner Music Group Company,5:19,"August 19 , 2014"
660290,Whateva ( feat . Monty ),Fetty Wap,Fetty Wap ( Deluxe ),"Hip-Hop/Rap , Music , Rap",Album Only,2015 300 Entertainment/RGF Productions,5:11,,How We Do Things ( feat . Monty ) [ Explicit ],Fetty Wap,Fetty Wap ( Deluxe ) [ Explicit ],Rap & Hip-Hop,$ 1.29,"( C ) 2000 Mute Records Ltd. , a BMG Company , under exclusive license to INgrooves",3:31,"September 25 , 2015"
658497,Feel So Close ( Instrumental ),Calvin Harris,Feel So Close ( Remixes ) - EP,"Dance , Music , R&B / Soul , Electronic",$ 1.29,2013 Sony Music Entertainment UK Limited,3:29,5-Feb-13,Feel So Close ( Dillon Francis Remix ),Calvin Harris,Feel So Close EP,Dance & Electronic,$ 1.29,( c ) 2012 So Much Dada,5:13,"February 5 , 2013"
301530,True Colors ( feat . Nicki Minaj ),Wiz Khalifa,Blacc Hollywood,"Hip-Hop/Rap , Music , Rap , East Coast Rap , Hardcore Rap , Rock",$ 1.29,2014 Atlantic Recording Corporation for the United States and WEA International Inc. for the world outside of the United States . A Warner Music Group Company,4:15,19-Aug-14,Still Down ( feat . Chevy Woods & Ty Dolla $ ign ) [ Explicit ],Wiz Khalifa,Blacc Hollywood ( Deluxe ) [ Explicit ],Rap & Hip-Hop,$ 1.29,2014 Atlantic Recording Corporation for the United States and WEA International Inc. for the world outside of the United States . A Warner Music Group Company,4:16,"August 19 , 2014"
661397,Rewind ( feat . Monty ),Fetty Wap,Fetty Wap,"Hip-Hop/Rap , Music , Rap",Album Only,2015 300 Entertainment/RGF Productions,5:36,,How We Do Things ( feat . Monty ) [ Clean ],Fetty Wap,Fetty Wap [ Clean ],Rap & Hip-Hop,$ 1.29,"( C ) 2000 Mute Records Ltd. , a BMG Company , under exclusive license to INgrooves",3:31,"September 25 , 2015"
317672,Judas ( Royksopp 's 30 Pieces Remix ),Lady Gaga,Born This Way ( The Remix ),"Pop , Music , Dance",Album Only,2011 Interscope Records,9:18,21-Nov-11,Marry The Night ( The Weeknd & Illangelo Remix ),Lady Gaga,Born This Way - The Remix,Pop,$ 1.29,( C ) 2011 Interscope Records,4:03,"November 21 , 2011"
661545,Whateva ( feat . Monty ),Fetty Wap,Fetty Wap ( Deluxe ),"Hip-Hop/Rap , Music , Rap",Album Only,2015 300 Entertainment/RGF Productions,5:11,,Jugg ( feat . Monty ) [ Clean ],Fetty Wap,Fetty Wap [ Clean ],Rap & Hip-Hop,$ 1.29,"( C ) 2000 Mute Records Ltd. , a BMG Company , under exclusive license to INgrooves",3:20,"September 25 , 2015"
301478,True Colors ( feat . Nicki Minaj ),Wiz Khalifa,Blacc Hollywood,"Hip-Hop/Rap , Music , Rap , East Coast Rap , Hardcore Rap , Rock",$ 1.29,2014 Atlantic Recording Corporation for the United States and WEA International Inc. for the world outside of the United States . A Warner Music Group Company,4:15,19-Aug-14,So High ( feat . Ghost Loft ) [ Explicit ],Wiz Khalifa,Blacc Hollywood ( Deluxe ) [ Explicit ],Rap & Hip-Hop,$ 1.29,2014 Atlantic Recording Corporation for the United States and WEA International Inc. for the world outside of the United States . A Warner Music Group Company,4:09,"August 19 , 2014"
310276,Protector of the Common Folk,Howard Shore,The Hobbit : The Desolation of Smaug ( Original Motion Picture Soundtrack ) [ Special Edition ],"Soundtrack , Music , Soundtrack , Classical , Original Score",$ 1.29,‰ ãÑ 2013 WaterTower Music,3:35,10-Dec-13,Fall Of Freetown,James Newton Howard,Blood Diamond ( Original Motion Picture Soundtrack ),Soundtracks,$ 1.29,( C ) 2006 Warner Bros. . Entertainment Inc.,4:45,"September 20 , 2013"
938581,Rashi ( Outro ),Mark Ronson,Here Comes the Fuzz,"Dance,Music,Hip-Hop / Rap,Hip-Hop , Alternative Rap , R&B / Soul , Soul , Electronic",$ 0.99,2003 Elektra Entertainment for the United States and WEA International Inc. for the world outside of the United States .,2:01,29-Aug-03,Rashi ( Outro ),Mark Ronson,Here Comes The Fuzz [ Clean ],Dance & Electronic,$ 0.99,( c ) 2015 Karaoke Freaks,2:01,"August 29 , 2003"
308194,Black Magic ( Acoustic ),Little Mix,Black Magic ( Remixes ) - Single,"Pop , Music , Rock",$ 1.29,2015 Simco Limited,3:27,13-Jul-15,Black Magic,Little Mix,Black Magic,Pop,$ 1.29,2015 Real Sounds,3:31,"May 27 , 2015"
888754,Ai n't Back Yet,Kenny Chesney,Greatest Hits II,"Country , Music , Urban Cowboy , Contemporary Country",$ 1.29,2010 Sony Music Entertainment,3:59,1-Mar-10,Back Where I Come From ( New Recording with Kenny 's Band ),Kenny Chesney,Greatest Hits,Country,$ 1.29,( C ) 2014 La industria Inc,4:16,"September 26 , 2000"
337203,This Is What Makes Us Girls,Lana Del Rey,Born To Die,"Alternative , Music , Rock , Adult Alternative",$ 1.29,2013 Lana Del Rey under exclusive licence to Polydor Ltd. ( UK ) . Under exclusive licence to Interscope Records in the USA,4:00,6-Aug-13,This Is What Makes Us Girls,Lana Del Rey,Born To Die [ Explicit ],"Alternative Rock , Indie & Lo-Fi",$ 1.29,( C ) 2012 Lana Del Rey under exclusive licence to Polydor Ltd. ( UK ) . Under exclusive licence to Interscope Records in the USA,4:00,"January 30 , 2012"
661039,Whateva ( feat . Monty ),Fetty Wap,Fetty Wap ( Deluxe ),"Hip-Hop/Rap , Music , Rap",Album Only,2015 300 Entertainment/RGF Productions,5:11,,Rock My Chain ( feat . M80 ) [ Explicit ],Fetty Wap,Fetty Wap ( Deluxe ) [ Explicit ],Rap & Hip-Hop,$ 1.29,"( C ) 2000 Mute Records Ltd. , a BMG Company , under exclusive license to INgrooves",4:07,"September 25 , 2015"
662219,Rewind ( feat . Monty ),Fetty Wap,Fetty Wap,"Hip-Hop/Rap , Music , Rap",Album Only,2015 300 Entertainment/RGF Productions,5:36,,Rock My Chain ( feat . M80 ) [ Clean ],Fetty Wap,Fetty Wap [ Clean ],Rap & Hip-Hop,$ 1.29,"( C ) 2000 Mute Records Ltd. , a BMG Company , under exclusive license to INgrooves",4:07,"September 25 , 2015"
130131,Applause ( Goldhouse Remix ),Lady Gaga,Applause ( Remixes ),"Pop , Music , Electronic , Rock",$ 1.29,2013 Interscope Records,4:34,30-Sep-13,Applause ( Purity Ring Remix ),Lady Gaga,Applause ( Remixes ),Pop,$ 1.29,( C ) 2013 Interscope Records,3:04,"September 30 , 2013"
662495,Whateva ( feat . Monty ),Fetty Wap,Fetty Wap ( Deluxe ),"Hip-Hop/Rap , Music , Rap",Album Only,2015 300 Entertainment/RGF Productions,5:11,,Jugg ( feat . Monty ) [ Explicit ],Fetty Wap,Fetty Wap [ Explicit ],Rap & Hip-Hop,$ 1.29,"( C ) 2000 Mute Records Ltd. , a BMG Company , under exclusive license to INgrooves",3:20,"September 25 , 2015"
353736,Daughter 's Lament,The Carolina Chocolate Drops,The Hunger Games ( Songs from District 12 and Beyond ),"Soundtrack , Music",$ 1.29,"‰ ãÑ 2012 Universal Republic Records , a division of UMG Recordings , Inc.",2:46,20-Mar-12,a medium 's high,Broadcast And The Focus Group,Broadcast And The Focus Group Investigate Witch Cults Of The Radio Age,"Alternative Rock , Indie & Lo-Fi , Dance & Electronic",$ 0.99,2009 Warp Records Limited,2:29,"October 26 , 2009"
825155,You Gon na Fly,Keith Urban,Get Closer ( Deluxe Version ),"Country , Music , Honky Tonk , Pop , Pop/Rock , Contemporary Country , Rock",$ 1.29,"‰ ãÑ 2010 Hit Red Records under exclusive license to Capitol Records Nashville . All rights reserved . Unauthorized reproduction is a violation of applicable laws . Manufactured by Capitol Records Nashville , 3322 West End Avenue , 11th Floor , Nashville , TN 37",3:36,22-Feb-11,Without You,Keith Urban,Get Closer ( Deluxe Version ),Country,$ 1.29,( C ) 2011 Hit Red Records under exclusive license to Capitol Records Nashville,3:55,"February 22 , 2011"
441983,Your Mama Should 've Named You Whiskey,Luke Bryan,Crash My Party ( Deluxe ),"Country , Music , Contemporary Country",$ 1.29,2014 Capitol Records Nashville,3:42,12-Aug-14,I See You,Luke Bryan,Crash My Party ( Deluxe Version ),Country,$ 1.29,( C ) 2014 Capitol Records Nashville,3:06,"August 12 , 2014"
299965,True Colors ( feat . Nicki Minaj ),Wiz Khalifa,Blacc Hollywood,"Hip-Hop/Rap , Music , Rap , East Coast Rap , Hardcore Rap , Rock",$ 1.29,2014 Atlantic Recording Corporation for the United States and WEA International Inc. for the world outside of the United States . A Warner Music Group Company,4:15,19-Aug-14,True Colors ( feat . Nicki Minaj ) [ Explicit ],Wiz Khalifa,Blacc Hollywood ( Deluxe ) [ Explicit ],Rap & Hip-Hop,$ 1.29,2014 Atlantic Recording Corporation for the United States and WEA International Inc. for the world outside of the United States . A Warner Music Group Company,4:15,"August 19 , 2014"
661747,Whateva ( feat . Monty ),Fetty Wap,Fetty Wap ( Deluxe ),"Hip-Hop/Rap , Music , Rap",Album Only,2015 300 Entertainment/RGF Productions,5:11,,My Way ( feat . Monty ) [ Clean ],Fetty Wap,Fetty Wap [ Clean ],Rap & Hip-Hop,$ 1.29,"( C ) 2000 Mute Records Ltd. , a BMG Company , under exclusive license to INgrooves",3:32,"September 25 , 2015"
